<?xml version="1.0.0" encoding="utf-8">
<!DOCTYPE ini SYSTEM "ini.dtd">
<ini>
  <font>
    <handwriting1>h1.ttf</handwriting1>
    <handwriting2>h2.ttf</handwriting2>
    <artwriting1>a1.ttf</artwriting1>
    <artwriting2>a2.ttf</artwriting2>
    <printing1>p1.ttf</printing1>
    <printing2>p2.ttf</printing2>
  </font>
  <maincolor>
    <green>green.css</green>
    <red>red.css</red>
    <blue>blue.css</blue>
    <night>night.css</night>
    <snow>snow.css</snow>
    <yellow>yellow.css</yellow>
  </maincolor>
<ini>
